<?xml version="1.0" encoding="UTF-8"?>
<!-- Test Case 1: Valid Resume - Should Pass Validation -->
<resume xmlns:xsi="http://www.w3.org/2001/XMLSchema-instance"
        xsi:noNamespaceSchemaLocation="resume.xsd">
    <personalInfo>
        <fullName>Test User</fullName>
        <title>Software Developer</title>
        <contact>
            <phone>+1-555-123-4567</phone>
            <email>test@example.com</email>
            <address>
                <city>New York</city>
                <country>USA</country>
            </address>
        </contact>
    </personalInfo>
    <summary>Experienced software developer with expertise in web technologies.</summary>
    <skills>
        <skillCategory name="Programming">
            <skill level="advanced">Java</skill>
            <skill level="intermediate">Python</skill>
        </skillCategory>
    </skills>
    <education>
        <degree>
            <level>Bachelor</level>
            <field>Computer Science</field>
            <institution>Test University</institution>
            <graduationDate>2020-05-15</graduationDate>
            <startDate>2016-09-01</startDate>
            <location>
                <city>Boston</city>
                <country>USA</country>
            </location>
        </degree>
    </education>
    <experience>
        <job>
            <title>Software Developer</title>
            <company>Tech Corp</company>
            <employmentType>Full-Time</employmentType>
            <startDate>2020-06-01</startDate>
            <endDate>2024-01-31</endDate>
            <location>
                <city>San Francisco</city>
                <country>USA</country>
            </location>
            <responsibilities>
                <responsibility>Developed web applications</responsibility>
                <responsibility>Maintained existing systems</responsibility>
            </responsibilities>
        </job>
    </experience>
    <languages>
        <language proficiency="native">English</language>
    </languages>
</resume>

<!-- 
ERROR TEST CASES TO CREATE SEPARATE FILES:

1. invalid-email-test.xml - Invalid email format
2. invalid-phone-test.xml - Invalid phone format  
3. invalid-date-test.xml - Invalid date format
4. invalid-skill-level-test.xml - Invalid skill level
5. invalid-employment-type-test.xml - Invalid employment type
6. missing-required-elements-test.xml - Missing required elements
7. invalid-degree-level-test.xml - Invalid degree level
8. invalid-proficiency-test.xml - Invalid language proficiency
9. future-graduation-date-test.xml - Future graduation date (logical error)
10. overlapping-dates-test.xml - Overlapping employment dates (logical error)
-->